{
  "meta": {
    "language": "es",
    "level": "B2",
    "version": 1,
    "generatedAt": "2026-06-09"
  },
  "passages": [
    {
      "id": "p-lesen-1",
      "module": "lesen",
      "title": "Turismo sostenible",
      "text": "Muchas ciudades europeas limitan el número de visitantes para proteger el patrimonio histórico. Los hoteleros afirman que las restricciones reducen los ingresos, pero los vecinos celebran la disminución del ruido. Expertos recomiendan combinar cupos turísticos con transporte público eficiente."
    },
    {
      "id": "p-horen-1",
      "module": "horen",
      "title": "Debate radiofónico: energía solar",
      "text": "Presentadora: ¿Es viable cubrir todos los tejados con paneles solares? Ingeniero: Es una parte de la solución, no la solución completa. Hay que mejorar también el almacenamiento. Presentadora: ¿Y el coste? Ingeniero: Ha bajado un 40% en la última década."
    }
  ],
  "questions": [
    {
      "id": "lb-es-b2-l1",
      "module": "lesen",
      "type": "true_false",
      "question": "Algunas ciudades limitan el número de turistas.",
      "correct": "True",
      "correctAnswer": "True",
      "explanation": "El texto lo afirma al inicio.",
      "grammarTags": [
        "g-es-b2-passive"
      ],
      "topicTags": [
        "turismo"
      ],
      "difficulty": 3,
      "passageId": "p-lesen-1",
      "teil": 1
    },
    {
      "id": "lb-es-b2-l2",
      "module": "lesen",
      "type": "multiple",
      "question": "¿Qué recomiendan los expertos?",
      "options": [
        "a) Prohibir el turismo",
        "b) Combinar cupos con transporte público",
        "c) Cerrar los museos"
      ],
      "correct": "b",
      "correctAnswer": "b",
      "explanation": "Combinar cupos turísticos con transporte.",
      "grammarTags": [
        "g-es-b2-subj-past"
      ],
      "topicTags": [
        "medio-ambiente"
      ],
      "difficulty": 4,
      "passageId": "p-lesen-1",
      "teil": 1
    },
    {
      "id": "lb-es-b2-h1",
      "module": "horen",
      "type": "multiple",
      "question": "¿Qué dice el ingeniero sobre los tejados solares?",
      "options": [
        "a) Son la solución completa",
        "b) Son solo una parte de la solución",
        "c) Son imposibles"
      ],
      "correct": "b",
      "correctAnswer": "b",
      "explanation": "Una parte, no la solución completa.",
      "grammarTags": [
        "g-es-b2-passive"
      ],
      "topicTags": [
        "ciencia"
      ],
      "difficulty": 3,
      "passageId": "p-horen-1",
      "segmentLabel": "Grabación 1",
      "teil": 1
    },
    {
      "id": "lb-es-b2-h2",
      "module": "horen",
      "type": "true_false",
      "question": "El coste de la energía solar ha bajado en la última década.",
      "correct": "True",
      "correctAnswer": "True",
      "explanation": "Ha bajado un 40%.",
      "grammarTags": [
        "g-es-b2-subj-past"
      ],
      "topicTags": [
        "economia"
      ],
      "difficulty": 4,
      "passageId": "p-horen-1",
      "segmentLabel": "Grabación 1",
      "teil": 1
    }
  ],
  "vocabulary": {
    "patrimonio": {
      "en": "heritage",
      "de": "Kulturerbe",
      "type": "noun"
    },
    "tejado": {
      "en": "roof",
      "de": "Dach",
      "type": "noun"
    },
    "almacenamiento": {
      "en": "storage",
      "de": "Speicherung",
      "type": "noun"
    }
  }
}
