{
  "meta": {
    "language": "es",
    "level": "C1",
    "version": 1,
    "generatedAt": "2026-06-09"
  },
  "passages": [
    {
      "id": "p-lesen-1",
      "module": "lesen",
      "title": "Literatura y crítica social",
      "text": "Varios académicos sostienen que la novela contemporánea funciona como archivo moral de tensiones sociales. Lejos de ser mero entretenimiento, articula conflictos que los medios simplifican. El reto del lector crítico consiste en reconocer la ideología sin reducir la obra a un manifiesto."
    },
    {
      "id": "p-horen-1",
      "module": "horen",
      "title": "Conferencia: ética de la IA",
      "text": "Ponente: La regulación debe anticipar riesgos sistémicos, no solo casos aislados. Pregunta: ¿Quién responde cuando falla un algoritmo? Ponente: La cadena de responsabilidad debe ser explícita y verificable."
    }
  ],
  "questions": [
    {
      "id": "lb-es-c1-l1",
      "module": "lesen",
      "type": "multiple",
      "question": "¿Cómo describen los académicos la novela contemporánea?",
      "options": [
        "a) Como archivo moral",
        "b) Como manual técnico",
        "c) Como deporte"
      ],
      "correct": "a",
      "correctAnswer": "a",
      "explanation": "Funciona como archivo moral.",
      "grammarTags": [
        "g-es-c1-register"
      ],
      "topicTags": [
        "literatura"
      ],
      "difficulty": 4,
      "passageId": "p-lesen-1",
      "teil": 1
    },
    {
      "id": "lb-es-c1-l2",
      "module": "lesen",
      "type": "true_false",
      "question": "El lector crítico debe evitar reducir la obra a un manifiesto.",
      "correct": "True",
      "correctAnswer": "True",
      "explanation": "Reconocer ideología sin reducir la obra.",
      "grammarTags": [
        "g-es-c1-register"
      ],
      "topicTags": [
        "filosofia"
      ],
      "difficulty": 5,
      "passageId": "p-lesen-1",
      "teil": 1
    },
    {
      "id": "lb-es-c1-h1",
      "module": "horen",
      "type": "multiple",
      "question": "¿Qué debe anticipar la regulación?",
      "options": [
        "a) Riesgos sistémicos",
        "b) Solo moda",
        "c) Nada"
      ],
      "correct": "a",
      "correctAnswer": "a",
      "explanation": "Anticipar riesgos sistémicos.",
      "grammarTags": [
        "g-es-c1-register"
      ],
      "topicTags": [
        "etica"
      ],
      "difficulty": 5,
      "passageId": "p-horen-1",
      "segmentLabel": "Grabación 1",
      "teil": 1
    },
    {
      "id": "lb-es-c1-h2",
      "module": "horen",
      "type": "true_false",
      "question": "La responsabilidad debe ser verificable.",
      "correct": "True",
      "correctAnswer": "True",
      "explanation": "Cadena explícita y verificable.",
      "grammarTags": [
        "g-es-c1-register"
      ],
      "topicTags": [
        "derechos"
      ],
      "difficulty": 4,
      "passageId": "p-horen-1",
      "segmentLabel": "Grabación 1",
      "teil": 1
    }
  ],
  "vocabulary": {
    "ideología": {
      "en": "ideology",
      "de": "Ideologie",
      "type": "noun"
    },
    "manifiesto": {
      "en": "manifesto",
      "de": "Manifest",
      "type": "noun"
    },
    "verificable": {
      "en": "verifiable",
      "de": "überprüfbar",
      "type": "adjective"
    }
  }
}
